{
    "initialization" : {
        "showPowerAlert" : true,
        "restoreIdentifier" : "xxx"
    },
    
    "scanning" : {
        "allowDuplicates" : false,
        "solicitedServices" : []
    },
    
    "connection" : {
        "notifyOnConnection" : true,
        "notifyOnDisconnection" : true,
        "notifyOnNotification" : true,
        "timeout" : 2.0,
        "attempts" : 3
    },
    
    "services" : {
        "6E400001-B5A3-F393-E0A9-E50E24DCCA9E" : {
            "name" : "UART",
            "characteristics" : {
                "6E400002-B5A3-F393-E0A9-E50E24DCCA9E" : {
                    "name" : "TX",
                    "notify" : false
                },
                "6E400003-B5A3-F393-E0A9-E50E24DCCA9E" : {
                    "name" : "RX",
                    "notify" : true
                }
            }
        }
    }
}
